{
  "action_domain": [
    "STOP",
    "CREEP",
    "PROCEED"
  ],
  "claim_scope": "P0B_HIGH_LEVEL_ELABORATION_AND_BOUNDED_CONFORMANCE_NOT_VEHICLE_SAFETY",
  "collection_id": "label_light_two_scene_request__indexed_collection",
  "collection_version": "eblc-indexed-collection-v0.1",
  "composition_evidence_refs": [
    "P0B-SYNTHETIC-COMPOSITION-POLICY-v0"
  ],
  "frames": 8,
  "instances": [
    {
      "allowed_actions": [
        "STOP"
      ],
      "association": {
        "candidate_target_entity_ids": [
          "pedestrian:P17"
        ],
        "candidate_zone_ids": [
          "zone:Z4"
        ],
        "coordinate_transform_ref": "TRANSFORM-001",
        "evidence_refs": [
          "ASSOC-001",
          "CALIBRATION-001",
          "TRACK-001",
          "GEOMETRY-001",
          "TRANSFORM-001"
        ],
        "reason_codes": [],
        "status": "BOUND",
        "target_entity_id": "pedestrian:P17",
        "zone_geometry_ref": "GEOMETRY-001",
        "zone_id": "zone:Z4"
      },
      "contract_id": "label_light_scene_001_contract",
      "instance_id": "label_light_scene_001_instance",
      "overrides_contracts": [],
      "priority_tier": "HARD",
      "zone_entry": {
        "evidence_refs": [
          "GEOMETRY-001"
        ],
        "frame": "ego_path_s",
        "unit": "m",
        "value": 0.0
      }
    },
    {
      "allowed_actions": [
        "STOP"
      ],
      "association": {
        "candidate_target_entity_ids": [
          "pedestrian:P18"
        ],
        "candidate_zone_ids": [
          "zone:Z5"
        ],
        "coordinate_transform_ref": "TRANSFORM-002",
        "evidence_refs": [
          "ASSOC-002",
          "CALIBRATION-001",
          "TRACK-002",
          "GEOMETRY-002",
          "TRANSFORM-002"
        ],
        "reason_codes": [],
        "status": "BOUND",
        "target_entity_id": "pedestrian:P18",
        "zone_geometry_ref": "GEOMETRY-002",
        "zone_id": "zone:Z5"
      },
      "contract_id": "label_light_scene_002_contract",
      "instance_id": "label_light_scene_002_instance",
      "overrides_contracts": [],
      "priority_tier": "HARD",
      "zone_entry": {
        "evidence_refs": [
          "GEOMETRY-002"
        ],
        "frame": "ego_path_s",
        "unit": "m",
        "value": 12.0
      }
    }
  ],
  "source_refs": [
    "ASSOC-001",
    "ASSOC-002",
    "CALIBRATION-001",
    "GEOMETRY-001",
    "GEOMETRY-002",
    "OBS-001",
    "OBS-002",
    "P0B-CONTROLLED-CONFORMANCE-ORACLE-v0",
    "P0B-SYNTHETIC-COMPOSITION-POLICY-v0",
    "P0B-SYNTHETIC-PREDICATE-SPEC-v0",
    "P0B-SYNTHETIC-SYSTEM-REQUIREMENT-PED-YIELD-v0",
    "TEST-VEHICLE-ASSURANCE-v1",
    "TRACK-001",
    "TRACK-002",
    "TRANSFORM-001",
    "TRANSFORM-002"
  ],
  "template_program_ref": "label_light_two_scene_request__program_template"
}
